{
  "id": "reel-03-care",
  "title": "Уход за пластырем",
  "status": "draft",
  "format": "reels",
  "kind": "footage",
  "length_sec": 20,
  "fps": 24,
  "goal": "saves",
  "palette": [
    "white",
    "linen",
    "teal"
  ],
  "hook": {
    "ru": "Пластырь многоразовый",
    "uz": "Пластир кўп марта ишлатилади"
  },
  "shots": [
    {
      "n": 1,
      "start": 0.0,
      "end": 2.5,
      "visual": "Макро: капли воды стекают по прозрачной поверхности пластыря, контровой свет",
      "text_ru": "Пластырь многоразовый",
      "text_uz": "Пластир кўп марта ишлатилади",
      "sound": "Капли",
      "scene": "drop"
    },
    {
      "n": 2,
      "start": 2.5,
      "end": 6.0,
      "visual": "Руки моют пластырь под краном мягким мылом, пена в кадре",
      "text_ru": "1. Мойте мягким мылом",
      "text_uz": "1. Юмшоқ совун билан ювинг",
      "sound": "Вода, пена",
      "scene": "wash"
    },
    {
      "n": 3,
      "start": 6.0,
      "end": 10.0,
      "visual": "Сверху: пластырь на чистом полотенце клейкой стороной вверх",
      "text_ru": "2. Сушите клейкой стороной вверх",
      "text_uz": "2. Ёпишқоқ томонини юқорига қаратиб қуритинг",
      "sound": "Тихий ambient",
      "scene": "dry"
    },
    {
      "n": 4,
      "start": 10.0,
      "end": 14.0,
      "visual": "Руки кладут пластырь на защитную плёнку в упаковку",
      "text_ru": "3. Храните на плёнке",
      "text_uz": "3. Плёнкада сақланг",
      "sound": "Шелест плёнки",
      "scene": "store"
    },
    {
      "n": 5,
      "start": 14.0,
      "end": 17.0,
      "visual": "Пластырь на полке рядом с мыльницей",
      "text_ru": "Снимайте перед душем",
      "text_uz": "Душдан олдин ечинг",
      "sound": "Ambient",
      "scene": "shelf"
    },
    {
      "n": 6,
      "start": 17.0,
      "end": 20.0,
      "visual": "Макро: пластырь, который уже не липнет, край загибается; логотип",
      "text_ru": "Не липнет: пора заменить",
      "text_uz": "Ёпишмаса: алмаштириш вақти",
      "sound": "Затухание",
      "scene": "edge-lift"
    }
  ],
  "caption_ru": "Как ухаживать за силиконовым пластырем, чтобы он служил дольше. Мойте мягким мылом, сушите клейкой стороной вверх, храните на защитной плёнке. Сохраните памятку.",
  "caption_uz": "Силикон пластир узоқ хизмат қилиши учун уни қандай парвариш қилиш керак. Юмшоқ совун билан ювинг, ёпишқоқ томонини юқорига қаратиб қуритинг, ҳимоя плёнкасида сақланг. Эслатмани сақлаб қўйинг.",
  "hashtags": [
    "#silicare",
    "#силиконовыйпластырь",
    "#уходзарубцом"
  ],
  "disclaimer": true,
  "shows_product": true,
  "claims": [
    {
      "text": "пластырь многоразовый, моется мягким мылом",
      "source": "Инструкция по применению Yafho (Swanston-Med), раздел — УТОЧНИТЬ"
    },
    {
      "text": "сушить клейкой стороной вверх",
      "source": "Инструкция по применению Yafho (Swanston-Med), раздел — УТОЧНИТЬ"
    },
    {
      "text": "снимать перед душем",
      "source": "Инструкция по применению Yafho (Swanston-Med), раздел — УТОЧНИТЬ"
    }
  ],
  "reviewed_by_native_uz": false,
  "approved_by_owner": false
}
