{
  "id": "reel-01-how-to-apply",
  "title": "Как клеить за 20 секунд",
  "status": "draft",
  "format": "reels",
  "kind": "footage",
  "length_sec": 22,
  "fps": 24,
  "goal": "sends_per_reach",
  "palette": [
    "linen",
    "white",
    "teal"
  ],
  "hook": {
    "ru": "Как клеить за 20 секунд",
    "uz": "20 сонияда ёпиштириш"
  },
  "shots": [
    {
      "n": 1,
      "start": 0.0,
      "end": 2.5,
      "visual": "Макро упаковки Silicare на льне, медленный наезд, контровой свет по краю",
      "text_ru": "Как клеить за 20 секунд",
      "text_uz": "20 сонияда ёпиштириш",
      "sound": "Низкий тихий тон",
      "scene": "pack"
    },
    {
      "n": 2,
      "start": 2.5,
      "end": 6.0,
      "visual": "Руки протирают и промакивают предплечье, боковой свет окна",
      "text_ru": "1. Кожа чистая и сухая",
      "text_uz": "1. Тери тоза ва қуруқ",
      "sound": "Шелест ткани",
      "scene": "skin-prep"
    },
    {
      "n": 3,
      "start": 6.0,
      "end": 10.0,
      "visual": "Макро: пальцы снимают защитную плёнку за край, свет проходит сквозь силикон",
      "text_ru": "2. Не касайтесь клейкой стороны",
      "text_uz": "2. Ёпишқоқ томонга тегманг",
      "sound": "Тихий щелчок отклеивания",
      "scene": "peel"
    },
    {
      "n": 4,
      "start": 10.0,
      "end": 15.0,
      "visual": "Сверху: пластырь ложится от центра к краям, ладонь разглаживает, плавный слайд",
      "text_ru": "3. Перекройте линию на 1 см",
      "text_uz": "3. Чизиқдан 1 см ортиқ қопланг",
      "sound": "Мягкое скольжение",
      "scene": "apply"
    },
    {
      "n": 5,
      "start": 15.0,
      "end": 19.0,
      "visual": "Средний план: рука сгибает локоть, пластырь держится",
      "text_ru": "Носить 12–24 часа в день",
      "text_uz": "Кунига 12–24 соат",
      "sound": "Ambient",
      "scene": "flex"
    },
    {
      "n": 6,
      "start": 19.0,
      "end": 22.0,
      "visual": "Общий план: стол, упаковка, чашка чая, логотип sil·icare by Yafho",
      "text_ru": "Сохраните и отправьте подруге-маме",
      "text_uz": "Сақлаб қўйинг ва дугона-онага юборинг",
      "sound": "Затухание тона",
      "scene": "still-life",
      "props": [
        "pack",
        "cup"
      ]
    }
  ],
  "caption_ru": "Как клеить силиконовый пластырь от рубца за 20 секунд. Три шага: чистая сухая кожа, не касаться клейкой стороны, перекрыть линию рубца на 1 см. Носить 12–24 часа в день. Сохраните, чтобы не забыть.",
  "caption_uz": "Чандиқ учун силикон пластирни 20 сонияда қандай ёпиштириш мумкин. Уч қадам: тоза ва қуруқ тери, ёпишқоқ томонга тегманг, чандиқ чизиғидан 1 см ортиқ қопланг. Кунига 12–24 соат тақинг. Унутмаслик учун сақлаб қўйинг.",
  "hashtags": [
    "#silicare",
    "#рубец",
    "#силиконовыйпластырь",
    "#послекесарева"
  ],
  "disclaimer": true,
  "shows_product": true,
  "claims": [
    {
      "text": "носить 12–24 часа в день",
      "source": "Инструкция по применению Yafho (Swanston-Med), раздел — УТОЧНИТЬ"
    },
    {
      "text": "перекрыть линию рубца на 1 см",
      "source": "Инструкция по применению Yafho (Swanston-Med), раздел — УТОЧНИТЬ"
    },
    {
      "text": "наносить на чистую сухую кожу",
      "source": "Инструкция по применению Yafho (Swanston-Med), раздел — УТОЧНИТЬ"
    }
  ],
  "reviewed_by_native_uz": false,
  "approved_by_owner": false
}
