{
  "id": "reel-04-why-scar-thickens",
  "title": "Почему рубец становится грубым",
  "status": "draft",
  "format": "reels",
  "kind": "animation",
  "length_sec": 25,
  "fps": 24,
  "goal": "completion",
  "palette": [
    "linen",
    "graphite",
    "teal"
  ],
  "hook": {
    "ru": "Почему рубец становится грубым?",
    "uz": "Чандиқ нега дағал бўлади?"
  },
  "shots": [
    {
      "n": 1,
      "start": 0.0,
      "end": 3.0,
      "visual": "Макротекстура кожи, медленный пролёт камеры вдоль поверхности",
      "text_ru": "Почему рубец становится грубым?",
      "text_uz": "Чандиқ нега дағал бўлади?",
      "sound": "Низкий drone"
    },
    {
      "n": 2,
      "start": 3.0,
      "end": 7.0,
      "visual": "Камера входит в срез: тонкие линии эпидермиса и дермы",
      "text_ru": "Рана заживает: организм делает коллаген",
      "text_uz": "Яра битади: организм коллаген ишлаб чиқаради",
      "sound": "Нарастающий тон"
    },
    {
      "n": 3,
      "start": 7.0,
      "end": 12.0,
      "visual": "Капли влаги уходят вверх с поверхности, цвет теплеет",
      "text_ru": "Считается, что без влаги коллагена больше",
      "text_uz": "Намликсиз коллаген кўпаяди, деб ҳисобланади",
      "sound": "Тон держится"
    },
    {
      "n": 4,
      "start": 12.0,
      "end": 16.0,
      "visual": "Волокна коллагена густеют, поверхность поднимается",
      "text_ru": "Рубец становится плотным и выпуклым",
      "text_uz": "Чандиқ зичлашиб, бўртиб чиқади",
      "sound": "Низкий акцент"
    },
    {
      "n": 5,
      "start": 16.0,
      "end": 21.0,
      "visual": "Сверху ложится прозрачный слой силикона, капли возвращаются под него, цвет уходит в тил",
      "text_ru": "Силикон сохраняет влагу",
      "text_uz": "Силикон намликни сақлайди",
      "sound": "Тон светлеет"
    },
    {
      "n": 6,
      "start": 21.0,
      "end": 25.0,
      "visual": "Волокна выравниваются, логотип sil·icare by Yafho",
      "text_ru": "Силикон может помочь рубцу стать мягче. Результат индивидуален",
      "text_uz": "Силикон чандиқнинг юмшоқ бўлишига ёрдам бериши мумкин. Натижа индивидуал",
      "sound": "Мягкий аккорд"
    }
  ],
  "caption_ru": "Почему рубец становится грубым и выпуклым. Считается, что без влаги коллагена образуется больше, а силикон сохраняет влагу. Силикон может помочь рубцу стать мягче, результат индивидуален.",
  "caption_uz": "Чандиқ нега дағал ва бўртиқ бўлади. Намликсиз коллаген кўпроқ ҳосил бўлади, деб ҳисобланади, силикон эса намликни сақлайди. Силикон чандиқнинг юмшоқ бўлишига ёрдам бериши мумкин, натижа индивидуал.",
  "hashtags": [
    "#silicare",
    "#рубец",
    "#келоидныйрубец",
    "#наукаорубцах"
  ],
  "disclaimer": true,
  "shows_product": true,
  "claims": [
    {
      "text": "без влаги коллагена образуется больше",
      "source": "Mustoe и соавт., 2002/2014 — международные рекомендации по рубцам; Cochrane: качество доказательств низкое"
    },
    {
      "text": "силикон сохраняет влагу",
      "source": "Mustoe и соавт., 2002/2014 — международные рекомендации по рубцам; Cochrane: качество доказательств низкое"
    },
    {
      "text": "может помочь рубцу стать мягче, результат индивидуален",
      "source": "Mustoe и соавт., 2002/2014 — международные рекомендации по рубцам; Cochrane: качество доказательств низкое"
    }
  ],
  "reviewed_by_native_uz": false,
  "approved_by_owner": false
}