{
  "id": "reel-06-after-c-section",
  "title": "После кесарева",
  "status": "draft",
  "format": "reels",
  "kind": "footage",
  "length_sec": 22,
  "fps": 24,
  "goal": "sends_per_reach",
  "palette": [
    "powder",
    "linen"
  ],
  "hook": {
    "ru": "После кесарева: 5 вопросов о рубце",
    "uz": "Кесар кесишдан кейин: чандиқ ҳақида 5 савол"
  },
  "shots": [
    {
      "n": 1,
      "start": 0.0,
      "end": 3.0,
      "visual": "Утренняя кухня, чашка чая, детские носочки на подоконнике, контровой свет",
      "text_ru": "После кесарева: 5 вопросов о рубце",
      "text_uz": "Кесар кесишдан кейин: чандиқ ҳақида 5 савол",
      "sound": "Ambient кухни",
      "scene": "still-life",
      "props": [
        "cup",
        "socks"
      ]
    },
    {
      "n": 2,
      "start": 3.0,
      "end": 7.0,
      "visual": "Рука листает блокнот, текст размыт",
      "text_ru": "Когда начинать? После заживления, обычно через 2–3 недели, с врачом",
      "text_uz": "Қачон бошлаш? Яра битгач, одатда 2–3 ҳафта, шифокор билан",
      "sound": "Шелест страниц",
      "scene": "notebook"
    },
    {
      "n": 3,
      "start": 7.0,
      "end": 10.0,
      "visual": "Макро: полоска пластыря на льне",
      "text_ru": "Тонкая полоска телесного цвета",
      "text_uz": "Юпқа, тана рангидаги лента",
      "sound": "Тихий щелчок",
      "scene": "strip"
    },
    {
      "n": 4,
      "start": 10.0,
      "end": 14.0,
      "visual": "Календарь, рука отмечает неделю",
      "text_ru": "Носить 12–24 часа в день, минимум 2–3 месяца",
      "text_uz": "Кунига 12–24 соат, камида 2–3 ой",
      "sound": "Ambient",
      "scene": "calendar",
      "label": {
        "ru": "2–3",
        "uz": "2–3"
      },
      "sub": {
        "ru": "месяца",
        "uz": "ой"
      }
    },
    {
      "n": 5,
      "start": 14.0,
      "end": 18.0,
      "visual": "Детское одеяло, руки его расправляют",
      "text_ru": "При кормлении грудью уточните у врача",
      "text_uz": "Эмизиш пайтида шифокор билан маслаҳатлашинг",
      "sound": "Мягкая тишина",
      "scene": "blanket"
    },
    {
      "n": 6,
      "start": 18.0,
      "end": 22.0,
      "visual": "Рука отправляет сообщение на телефоне, экран не читается; логотип",
      "text_ru": "Отправьте другой маме",
      "text_uz": "Бошқа онага юборинг",
      "sound": "Лёгкий сигнал отправки",
      "scene": "phone"
    }
  ],
  "caption_ru": "Рубец после кесарева: 5 вопросов, которые задаёт каждая мама. Начинать после заживления, обычно через 2–3 недели, с врачом. Отправьте подруге, которой это пригодится.",
  "caption_uz": "Кесар кесишдан кейинги чандиқ: ҳар бир она берадиган 5 савол. Яра битгач, одатда 2–3 ҳафтадан кейин, шифокор билан бошланг. Керак бўладиган дугонангизга юборинг.",
  "hashtags": [
    "#silicare",
    "#послекесарева",
    "#рубецпослекесарева",
    "#мама"
  ],
  "disclaimer": true,
  "shows_product": true,
  "claims": [
    {
      "text": "начинать после заживления, обычно через 2–3 недели",
      "source": "Mustoe и соавт., 2002/2014 — международные рекомендации по рубцам; Cochrane: качество доказательств низкое"
    },
    {
      "text": "носить 12–24 часа в день, минимум 2–3 месяца",
      "source": "Инструкция по применению Yafho (Swanston-Med), раздел — УТОЧНИТЬ"
    },
    {
      "text": "при кормлении грудью уточнить у врача",
      "source": "Инструкция по применению Yafho (Swanston-Med), раздел — УТОЧНИТЬ"
    }
  ],
  "reviewed_by_native_uz": false,
  "approved_by_owner": false
}
